ID;locale;title;descr
201;de;Sturmhöhe;Sturmhöhe (Originaltitel: Wuthering Heights) ist der einzige Roman der englischen Schriftstellerin Emily Brontë (1818–1848). Der 1847 unter dem Pseudonym Ellis Bell veröffentlichte Roman wurde vom viktorianischen Publikum weitgehend abgelehnt, heute gilt er als ein Klassiker der britischen Romanliteratur des 19. Jahrhunderts.
201;fr;Les Hauts de Hurlevent;Les Hauts de Hurlevent (titre original : Wuthering Heights), parfois orthographié Les Hauts de Hurle-Vent, est l'unique roman d'Emily Brontë, publié pour la première fois en 1847 sous le pseudonyme d’Ellis Bell. Loin d'être un récit moralisateur, Emily Brontë achève néanmoins le roman dans une atmosphère sereine, suggérant le triomphe de la paix et du Bien sur la vengeance et le Mal.
207;de;Jane Eyre;Jane Eyre. Eine Autobiographie (Originaltitel: Jane Eyre. An Autobiography), erstmals erschienen im Jahr 1847 unter dem Pseudonym Currer Bell, ist der erste veröffentlichte Roman der britischen Autorin Charlotte Brontë und ein Klassiker der viktorianischen Romanliteratur des 19. Jahrhunderts. Der Roman erzählt in Form einer Ich-Erzählung die Lebensgeschichte von Jane Eyre (ausgesprochen /ˌdʒeɪn ˈɛə/), die nach einer schweren Kindheit eine Stelle als Gouvernante annimmt und sich in ihren Arbeitgeber verliebt, jedoch immer wieder um ihre Freiheit und Selbstbestimmung kämpfen muss. Als klein, dünn, blass, stets schlicht dunkel gekleidet und mit strengem Mittelscheitel beschrieben, gilt die Heldin des Romans Jane Eyre nicht zuletzt aufgrund der Kino- und Fernsehversionen der melodramatischen Romanvorlage als die bekannteste englische Gouvernante der Literaturgeschichte
252;de;Eleonora;“Eleonora” ist eine Erzählung von Edgar Allan Poe. Sie wurde 1841 erstveröffentlicht. In ihr geht es um das Paradox der Treue in der Treulosigkeit.
275;The Phoenix Project;"The Phoenix Project: A Novel About IT, DevOps, and Helping Your Business Win is a business novel by Gene Kim, Kevin Behr, and George Spafford. It presents a fictional case study of a troubled IT organization and its journey towards DevOps, emphasizing the importance of collaboration, automation, and continuous improvement.";180;33;14.99;USD;19
276;Italian Journey;"Italian Journey, a travelogue written by Johann Wolfgang von Goethe, recounts his travels through Italy between 1786 and 1788. The work is notable for its detailed descriptions of the Italian landscape, culture, and art, providing a valuable historical perspective.";190;44;11.50;EUR;13
277;Life 3.0;"Life 3.0: Being Human in the Age of Artificial Intelligence is a non-fiction book by Swedish-American physicist and cosmologist Max Tegmark. The book explores the implications of artificial intelligence and discusses potential scenarios of advanced AI impacting human society.";200;55;19.99;USD;16
278;A Transport Wizard's Tale;"A Transport Wizard's Tale: A tribute to the players who walked every street, spun every PokéStop, and caught every Pokémon. In memory of harry2ndstreet, whose adventures ended way too early.";42;10;0.00;USD;0
